{
  "attestation": {
    "measurement": {
      "mrtd": "f06dfda6dce1cf904d4e2bab1dc370634cf95cefa2ceb2de2eee127c9382698090d7a4a13e14c536ec6c9c3c8fa87077",
      "rtmr0": "68102e7b524af310f7b7d426ce75481e36c40f5d513a9009c046e9d37e31551f0134d954b496a3357fd61d03f07ffe96",
      "rtmr1": "07e6f51aa763abfe75c3ddfbf4f425fe3f0ceff66d807a75e049303dce9addf68e7218729bd419638af63a370f65878c",
      "rtmr2": "df67e467e60edc1737bcf8e682d48131bfb427f523226aa7f197a7608e9b3784783fa759ef5b28191fa12f9ddb36b858",
      "rtmr3": "cd18b364cab43a85a756471b1fb849f4cfff2aea6f68b7c8d96674cb842f1932d1e3e9b620b124dca8bc9d27dc657f01"
    },
    "quote": "040002008100000000000000939a7233f79c4ca9940a0db3957f0607cca1e818c0d9e8b17007c295c31004ec000000000b0105000000000000000000000000007bf063280e94fb051f5dd7b1fc59ce9aac42bb961df8d44b709c9b0ff87a7b4df648657ba6d1189589feab1d5a3c9a9d000000000000000000000000000000000000000000000000000000000000000000000000000000000000000000000000000000000000000000000010000000000702000000000000f06dfda6dce1cf904d4e2bab1dc370634cf95cefa2ceb2de2eee127c9382698090d7a4a13e14c536ec6c9c3c8fa87077014d6af8330c0904980a4a934b3628b1089f3733c6175df4594a5fd1874e84700900000000000000000000000000000000000000000000000000000000000000000000000000000000000000000000000000000000000000000000000000000000000000000000000000000000000000000000000000000000000000000000000000000000000000000000000000000068102e7b524af310f7b7d426ce75481e36c40f5d513a9009c046e9d37e31551f0134d954b496a3357fd61d03f07ffe9607e6f51aa763abfe75c3ddfbf4f425fe3f0ceff66d807a75e049303dce9addf68e7218729bd419638af63a370f65878cdf67e467e60edc1737bcf8e682d48131bfb427f523226aa7f197a7608e9b3784783fa759ef5b28191fa12f9ddb36b858cd18b364cab43a85a756471b1fb849f4cfff2aea6f68b7c8d96674cb842f1932d1e3e9b620b124dca8bc9d27dc657f01eb5c5de761409d620c578c8da7e497b472f60d6e56880a8130346a08cbc635344ad7fdcbc187b527dc2c66d6a1bd56477c2fabf433017b25d1dd656cd2ef2947d0100000fb3e1183e5c8d3dce0c0aea480a3e0859ae133f7397d230c77793860f8757211d7c0ad8774117c758418f2c152ac2e74c168f7dfb5029481edda907775faaac79e04d3f419f6fefccd570008a9383a56b10805f400827f1f860274c13986219ec834641cc39badf83be6c98dfb021cbfeff7775b3ab1594f5db195b3fc509acb06004a10000005050a0a05ff00020000000000000000000000000000000000000000000000000000000000000000000000000000000015000000000000000700000000000000e5a3a7b5d830c2953b98534c6c59a3a34fdc34e933f7f5898f0a85cf08846bca0000000000000000000000000000000000000000000000000000000000000000dc9e2a7c6f948f17474e34a7fc43ed030f7c1563f1babddf6340c82e0e54a8c500000000000000000000000000000000000000000000000000000000000000000000000000000000000000000000000000000000000000000000000000000000000000000000000000000000000000000000000000000000000000000000000002000600000000000000000000000000000000000000000000000000000000000000000000000000000000000000000000000000000000000000000000000000c3181e37daaa4153e416d13b28484d8abe8ce7b7a41faf7ee280baf0f304f84000000000000000000000000000000000000000000000000000000000000000001ad339371f86be7a326a416a8b7c954cad156b54712872ca0518ba69e37d49b1a8d68f0f6be00dc3d156baa38834050af9d9c67f4d311f8ef775166c1cddc6822000000102030405060708090a0b0c0d0e0f101112131415161718191a1b1c1d1e1f0500620e00002d2d2d2d2d424547494e2043455254494649434154452d2d2d2d2d0a4d494945386a4343424a69674177494241674956414b685252415768304973374f6c613841354433364879736641726c4d416f4743437147534d343942414d430a4d484178496a416742674e5642414d4d47556c756447567349464e4857434251513073675547786864475a76636d306751304578476a415942674e5642416f4d0a45556c756447567349454e76636e4276636d4630615739754d5251774567594456515148444174545957353059534244624746795954454c4d416b47413155450a4341774351304578437a414a42674e5642415954416c56544d423458445449324d4445794f5441314e5441314d566f5844544d7a4d4445794f5441314e5441310a4d566f77634445694d434147413155454177775a535735305a5777675530645949464244537942445a584a3061575a70593246305a5445614d426747413155450a43677752535735305a577767513239796347397959585270623234784644415342674e564241634d43314e68626e526849454e7359584a684d517377435159440a5651514944414a445154454c4d416b474131554542684d4356564d775754415442676371686b6a4f5051494242676771686b6a4f50514d4242774e434141546f0a487278654b587841794544784e343576302b7a48676250446a426a6f434c786b37544443306a50374754617a64504478333542364832416830614a7149796e440a34672b4263746e7068346b3353414d5a673057586f3449444454434341776b77487759445652306a42426777466f41556c5739647a62306234656c4153636e550a3944504f4156634c336c5177617759445652306642475177596a42676f46366758495a616148523063484d364c79396863476b7564484a316333526c5a484e6c0a636e5a705932567a4c6d6c75644756734c6d4e766253397a5a3367765932567964476c6d61574e6864476c76626939324e4339775932746a636d772f593245390a6347786864475a76636d306d5a57356a62325270626d63395a4756794d4230474131556444675157424253543746304969413438394565484573627a6a307a310a32662f4f677a414f42674e56485138424166384542414d434273417744415944565230544151482f4241497741444343416a6f4743537147534962345451454e0a41515343416973776767496e4d42344743697147534962345451454e4151454545474c565145444c6e66774975784d41623664657a6c59776767466b42676f710a686b69472b453042445145434d4949425644415142677371686b69472b45304244514543415149424254415142677371686b69472b45304244514543416749420a4254415142677371686b69472b4530424451454341774942416a415142677371686b69472b4530424451454342414942416a415142677371686b69472b4530420a44514543425149424254415242677371686b69472b4530424451454342674943415038774541594c4b6f5a496876684e4151304241676343415141774541594c0a4b6f5a496876684e4151304241676743415149774541594c4b6f5a496876684e4151304241676b43415141774541594c4b6f5a496876684e4151304241676f430a415141774541594c4b6f5a496876684e4151304241677343415141774541594c4b6f5a496876684e4151304241677743415141774541594c4b6f5a496876684e0a4151304241673043415141774541594c4b6f5a496876684e4151304241673443415141774541594c4b6f5a496876684e4151304241673843415141774541594c0a4b6f5a496876684e4151304241684143415141774541594c4b6f5a496876684e4151304241684543415130774877594c4b6f5a496876684e41513042416849450a45415546416749462f7741434141414141414141414141774541594b4b6f5a496876684e4151304241775143414141774641594b4b6f5a496876684e415130420a42415147494b4276414141414d41384743697147534962345451454e4151554b415145774867594b4b6f5a496876684e415130424267515155437844723245370a4b73656b434549476569682b3044424542676f71686b69472b453042445145484d4459774541594c4b6f5a496876684e4151304242774542416638774541594c0a4b6f5a496876684e4151304242774942416638774541594c4b6f5a496876684e4151304242774d4241663877436759494b6f5a497a6a304541774944534141770a525149684149434348435551515532364178732b4e6a6e79324836666668456d2f66473645756a4a684a58595a596a4241694254554835416e5071396e4b74380a7833687a4d397557532b58737877792b556c6941586e4d663030645345513d3d0a2d2d2d2d2d454e442043455254494649434154452d2d2d2d2d0a2d2d2d2d2d424547494e2043455254494649434154452d2d2d2d2d0a4d4949436c6a4343416a32674177494241674956414a567658633239472b487051456e4a3150517a7a674658433935554d416f4743437147534d343942414d430a4d476778476a415942674e5642414d4d45556c756447567349464e48574342536232393049454e424d526f77474159445651514b4442464a626e526c624342440a62334a7762334a6864476c76626a45554d424947413155454277774c553246756447456751327868636d4578437a414a42674e564241674d416b4e424d5173770a435159445651514745774a56557a4165467730784f4441314d6a45784d4455774d5442614677307a4d7a41314d6a45784d4455774d5442614d484178496a41670a42674e5642414d4d47556c756447567349464e4857434251513073675547786864475a76636d306751304578476a415942674e5642416f4d45556c75644756730a49454e76636e4276636d4630615739754d5251774567594456515148444174545957353059534244624746795954454c4d416b474131554543417743513045780a437a414a42674e5642415954416c56544d466b77457759484b6f5a497a6a3043415159494b6f5a497a6a304441516344516741454e53422f377432316c58534f0a3243757a7078773734654a423732457944476757357258437478327456544c7136684b6b367a2b5569525a436e71523770734f766771466553786c6d546c4a6c0a65546d693257597a33714f42757a43427544416642674e5648534d4547444157674251695a517a575770303069664f44744a5653763141624f536347724442530a42674e5648523845537a424a4d45656752614244686b466f64485277637a6f764c324e6c636e52705a6d6c6a5958526c63793530636e567a6447566b633256790a646d6c6a5a584d75615735305a577775593239744c306c756447567355306459556d397664454e424c6d526c636a416442674e5648513445466751556c5739640a7a62306234656c4153636e553944504f4156634c336c517744675944565230504151482f42415144416745474d42494741315564457745422f7751494d4159420a4166384341514177436759494b6f5a497a6a30454177494452774177524149675873566b6930772b6936565947573355462f32327561586530594a446a3155650a6e412b546a44316169356343494359623153416d4435786b66545670766f34556f79695359787244574c6d5552344349394e4b7966504e2b0a2d2d2d2d2d454e442043455254494649434154452d2d2d2d2d0a2d2d2d2d2d424547494e2043455254494649434154452d2d2d2d2d0a4d4949436a7a4343416a53674177494241674955496d554d316c71644e496e7a6737535655723951477a6b6e42717777436759494b6f5a497a6a3045417749770a614445614d4267474131554541777752535735305a5777675530645949464a766233516751304578476a415942674e5642416f4d45556c756447567349454e760a636e4276636d4630615739754d5251774567594456515148444174545957353059534244624746795954454c4d416b47413155454341774351304578437a414a0a42674e5642415954416c56544d423458445445344d4455794d5445774e4455784d466f58445451354d54497a4d54497a4e546b314f566f77614445614d4267470a4131554541777752535735305a5777675530645949464a766233516751304578476a415942674e5642416f4d45556c756447567349454e76636e4276636d46300a615739754d5251774567594456515148444174545957353059534244624746795954454c4d416b47413155454341774351304578437a414a42674e56424159540a416c56544d466b77457759484b6f5a497a6a3043415159494b6f5a497a6a3044415163445167414543366e45774d4449595a4f6a2f69505773437a61454b69370a314f694f534c52466857476a626e42564a66566e6b59347533496a6b4459594c304d784f346d717379596a6c42616c54565978465032734a424b357a6c4b4f420a757a43427544416642674e5648534d4547444157674251695a517a575770303069664f44744a5653763141624f5363477244425342674e5648523845537a424a0a4d45656752614244686b466f64485277637a6f764c324e6c636e52705a6d6c6a5958526c63793530636e567a6447566b63325679646d6c6a5a584d75615735300a5a577775593239744c306c7564